{
	"schemaVersion": 1,
	"stage": "stage-1-toolchain-contract",
	"capturedAt": "2026-07-15T06:00:00Z",
	"run": {
		"id": "stage1-20260715T052419Z-darwin-arm64",
		"results": {
			"path": "evidence/stage-1-toolchain-results.json",
			"sha256": "325caf84fca5258b17247168c12ead5dc09528151341bf890e9194615e0a096f"
		},
		"mutationResult": {
			"command": [
				"bun",
				"test",
				"scripts/template/__tests__/toolchain.test.ts",
				"scripts/template/__tests__/template.test.ts",
				"-t",
				"passes the real tree and rejects known-bad authority mutations|checksum verifier fails closed before archive extraction|renders minimal twice with identical manifests and no disabled residue"
			],
			"runId": "stage1-20260715T052419Z-darwin-arm64",
			"startedAt": "2026-07-15T05:59:09Z",
			"completedAt": "2026-07-15T05:59:10Z",
			"stdoutPath": "evidence/stage-1-toolchain-run/mutation.stdout",
			"stderrPath": "evidence/stage-1-toolchain-run/mutation.stderr",
			"stdoutSha256": "0c80abc01a2d8375c50a90ab08e86b1f06050d89e86349209b60dd7ba9c950a9",
			"stderrSha256": "3c76cf8bf32b096267d0c1026f9d5d47d7c61986de9e7ecf191f98068bbdf1f1",
			"status": "pass",
			"exitCode": 0
		}
	},
	"source": {
		"baseSha": "94863ed1b12d261e432702a76848916d92f89450",
		"implementationSha": "301f82dd92c31e2e335cc761afe238b1c2dfcf7a",
		"featureTreeClean": true
	},
	"proto": {
		"version": "0.55.4",
		"selectedTools": {
			"bun": "1.3.13",
			"node": "24.18.0",
			"moon": "2.3.5",
			"proto": "0.55.4",
			"direnv": "2.37.1",
			"fly": "0.3.231",
			"infisical": "0.41.90",
			"python": "3.14.2",
			"uv": "0.9.7",
			"jq": "1.8.1",
			"yq": "4.49.2",
			"dagger": "0.19.8"
		},
		"pluginCommits": [
			"786005a6ef2371ae1c7893610d065ac5612d61a9",
			"9808cc412785ac59ec1b0d61bd1bee152f6f6b56"
		],
		"checksums": {
			"amd64": "3f13534217fcf315c0579db6e1f87edd022d850144d9f3b0957a29586de34838",
			"arm64": "85406d411687412b729ef21f58f8ac2ddafa9e51eafc8ec1b4772af1b6ab98db"
		}
	},
	"catalog": {
		"consumerPolicy": "catalog:",
		"packageCount": 17,
		"packages": {
			"@biomejs/biome": "2.4.16",
			"@cloudflare/vite-plugin": "1.43.0",
			"@cloudflare/vitest-pool-workers": "0.18.0",
			"@commitlint/cli": "20.5.0",
			"@commitlint/config-conventional": "20.5.0",
			"@fission-ai/openspec": "0.19.0",
			"@hookform/resolvers": "5.4.0",
			"@playwright/test": "1.59.1",
			"@types/bun": "1.3.10",
			"@types/node": "25.5.0",
			"better-auth": "1.6.23",
			"husky": "9.1.7",
			"lint-staged": "16.4.0",
			"react-hook-form": "7.81.0",
			"typescript": "5.9.3",
			"wrangler": "4.107.0",
			"zod": "4.3.6"
		}
	},
	"coupledFamilies": {
		"cloudflare": {
			"wrangler": "4.107.0",
			"vitePlugin": "1.43.0",
			"vitestPool": "0.18.0",
			"miniflare": "4.20260701.0",
			"workerd": "1.20260701.1"
		},
		"betterAuth": {
			"package": "1.6.23",
			"core": "1.6.23"
		},
		"forms": {
			"zod": "4.3.6",
			"reactHookForm": "7.81.0",
			"resolvers": "5.4.0"
		},
		"playwright": {
			"test": "1.59.1",
			"runtime": "1.59.1",
			"core": "1.59.1"
		}
	},
	"locks": {
		"package": {
			"path": "bun.lock",
			"sha256": "1cb0eef43905f41c5290c251d414fc3c632fe3e5c1d5f87cb5eabc83e3bc9e14"
		},
		"features": {
			"path": ".devcontainer/devcontainer-lock.json",
			"sha256": "415ee207066b3fba6024345671ed010a7e0bc90c8f416f1d7877f45d471eca16",
			"count": 4
		},
		"protoChecksums": {
			"path": ".devcontainer/proto-checksums.txt",
			"sha256": "8682a658cc63efbb1dd3c428ec5dcbad662f18e659656a6febcdd413836cd051"
		}
	},
	"mutationProof": [
		{
			"name": "catalog-floating",
			"expected": "Reject a latest catalog selector",
			"observed": "catalog: @biomejs/biome must use an exact version",
			"test": "scripts/template/__tests__/toolchain.test.ts",
			"runId": "stage1-20260715T052419Z-darwin-arm64",
			"status": "pass"
		},
		{
			"name": "catalog-bypass",
			"expected": "Reject a direct version for a catalog-owned consumer",
			"observed": "catalog: root consumer @biomejs/biome must use catalog:",
			"test": "scripts/template/__tests__/toolchain.test.ts",
			"runId": "stage1-20260715T052419Z-darwin-arm64",
			"status": "pass"
		},
		{
			"name": "coupled-family-drift",
			"expected": "Reject a Cloudflare catalog pin that differs from the lock",
			"observed": "lock: wrangler does not resolve to catalog 4.108.0",
			"test": "scripts/template/__tests__/toolchain.test.ts",
			"runId": "stage1-20260715T052419Z-darwin-arm64",
			"status": "pass"
		},
		{
			"name": "second-resolution",
			"expected": "Reject a second runtime-sensitive lock resolution",
			"observed": "lock: wrangler must resolve exactly once, found 2 entries (4.107.0, 4.108.0)",
			"test": "scripts/template/__tests__/toolchain.test.ts",
			"runId": "stage1-20260715T052419Z-darwin-arm64",
			"status": "pass"
		},
		{
			"name": "mutable-proto-plugin",
			"expected": "Reject a mutable Proto plugin branch",
			"observed": "proto: plugin direnv must use an immutable commit URL",
			"test": "scripts/template/__tests__/toolchain.test.ts",
			"runId": "stage1-20260715T052419Z-darwin-arm64",
			"status": "pass"
		},
		{
			"name": "feature-lock-drift",
			"expected": "Reject differing feature resolution and integrity digests",
			"observed": "features: ghcr.io/devcontainers/features/common-utils:2 resolved reference and integrity differ",
			"test": "scripts/template/__tests__/toolchain.test.ts",
			"runId": "stage1-20260715T052419Z-darwin-arm64",
			"status": "pass"
		},
		{
			"name": "proto-checksum-format",
			"expected": "Reject malformed architecture checksum metadata",
			"observed": "proto: checksum architectures drift from template parameters",
			"test": "scripts/template/__tests__/toolchain.test.ts",
			"runId": "stage1-20260715T052419Z-darwin-arm64",
			"status": "pass"
		},
		{
			"name": "proto-checksum-mismatch",
			"expected": "Reject a valid-looking checksum that does not match the archive",
			"observed": "invalid checksum fixture exited nonzero in verify-only mode",
			"test": "scripts/template/__tests__/toolchain.test.ts",
			"runId": "stage1-20260715T052419Z-darwin-arm64",
			"status": "pass"
		},
		{
			"name": "typescript-baseurl",
			"expected": "Reject an active TypeScript baseUrl",
			"observed": "typescript: tsconfig.base.json reintroduces baseUrl",
			"test": "scripts/template/__tests__/toolchain.test.ts",
			"runId": "stage1-20260715T052419Z-darwin-arm64",
			"status": "pass"
		},
		{
			"name": "typescript-absolute-alias",
			"expected": "Reject an absolute TypeScript path target",
			"observed": "typescript: tsconfig.base.json contains an absolute path alias",
			"test": "scripts/template/__tests__/toolchain.test.ts",
			"runId": "stage1-20260715T052419Z-darwin-arm64",
			"status": "pass"
		},
		{
			"name": "workspace-path-priority",
			"expected": "Reject Proto resolution before workspace-local binaries",
			"observed": "path: .shell_common resolves Proto before workspace binaries",
			"test": "scripts/template/__tests__/toolchain.test.ts",
			"runId": "stage1-20260715T052419Z-darwin-arm64",
			"status": "pass"
		},
		{
			"name": "secondary-lockfile",
			"expected": "Reject a nested workspace package lock",
			"observed": "lock: secondary package lock tests/e2e/bun.lock is forbidden",
			"test": "scripts/template/__tests__/toolchain.test.ts",
			"runId": "stage1-20260715T052419Z-darwin-arm64",
			"status": "pass"
		},
		{
			"name": "disabled-family-omission",
			"expected": "Omit disabled package authorities and consumers from rendered fixtures",
			"observed": "minimal fixture guard and artifact scan contain no disabled family residue",
			"test": "scripts/template/__tests__/template.test.ts",
			"runId": "stage1-20260715T052419Z-darwin-arm64",
			"status": "pass"
		},
		{
			"name": "composite-action-bun-pin",
			"expected": "Reject an unpinned setup-bun action in local composite metadata",
			"observed": "proto: .github/actions/bootstrap/action.yml setup-bun omits bun-version",
			"test": "scripts/template/__tests__/toolchain.test.ts",
			"runId": "stage1-20260715T052419Z-darwin-arm64",
			"status": "pass"
		}
	],
	"validation": [
		{
			"command": ["bun", "install", "--frozen-lockfile"],
			"runId": "stage1-20260715T052419Z-darwin-arm64",
			"startedAt": "2026-07-15T05:38:44Z",
			"completedAt": "2026-07-15T05:38:44Z",
			"stdoutPath": "evidence/stage-1-toolchain-run/install.stdout",
			"stderrPath": "evidence/stage-1-toolchain-run/install.stderr",
			"stdoutSha256": "9ab93b86c540893ab1742e1ce4793fb9bf1fd129e2712596e4f41a747d8b0f3b",
			"stderrSha256": "1549e9b8128b223662d253210e73f7e29e9494049b92b239101a926f6f5b3d95",
			"status": "pass",
			"exitCode": 0
		},
		{
			"command": ["bun", "run", "toolchain:check"],
			"runId": "stage1-20260715T052419Z-darwin-arm64",
			"startedAt": "2026-07-15T05:38:44Z",
			"completedAt": "2026-07-15T05:38:45Z",
			"stdoutPath": "evidence/stage-1-toolchain-run/toolchain.stdout",
			"stderrPath": "evidence/stage-1-toolchain-run/toolchain.stderr",
			"stdoutSha256": "3fd2b95593a7482b057943f927e5ee77dda508eadd485ee0574ed41fb20518e6",
			"stderrSha256": "7b673fdb2eaf9541313beae59744635aeb03a86d30a1277bd3a71da3a1fe7193",
			"status": "pass",
			"exitCode": 0
		},
		{
			"command": ["bun", "run", "template:validate"],
			"runId": "stage1-20260715T052419Z-darwin-arm64",
			"startedAt": "2026-07-15T05:38:45Z",
			"completedAt": "2026-07-15T05:38:46Z",
			"stdoutPath": "evidence/stage-1-toolchain-run/validate.stdout",
			"stderrPath": "evidence/stage-1-toolchain-run/validate.stderr",
			"stdoutSha256": "0d62ae9bbb9a76963e342ddf8a76680a2ef35d4a75e835c4b1e0b7dc7f0e9041",
			"stderrSha256": "92e643170278cb7a9971ea975d44bb39ad263ed3d5c13d66b89d133e4a415582",
			"status": "pass",
			"exitCode": 0
		},
		{
			"command": ["bun", "run", "template:test"],
			"runId": "stage1-20260715T052419Z-darwin-arm64",
			"startedAt": "2026-07-15T05:38:46Z",
			"completedAt": "2026-07-15T05:38:52Z",
			"stdoutPath": "evidence/stage-1-toolchain-run/test.stdout",